{
  "contract": "JoyLab.ResearchGraph",
  "version": "1.0.0",
  "pillar": {
    "id": "ai-standards",
    "title": "AI Standards & Tech Sovereignty",
    "url": "/guides/ai-standards",
    "domain": "ai",
    "status": "published"
  },
  "lanes": [
    {
      "key": "language",
      "label": "LANGUAGE",
      "types": [
        "language"
      ]
    },
    {
      "key": "measurement",
      "label": "MEASUREMENT",
      "types": [
        "measurement"
      ]
    },
    {
      "key": "standard",
      "label": "STANDARD",
      "types": [
        "standard"
      ]
    },
    {
      "key": "governance",
      "label": "GOVERNANCE",
      "types": [
        "governance"
      ]
    },
    {
      "key": "discourse",
      "label": "DISCOURSE POWER",
      "types": [
        "discourse_power",
        "capability"
      ]
    }
  ],
  "nodes": [
    {
      "id": "ai-standards",
      "type": "pillar",
      "label": "AI Standards & Tech Sovereignty",
      "articleUrl": "/guides/ai-standards",
      "stage": "pillar"
    },
    {
      "id": "language-layer",
      "type": "language",
      "label": "Technology Language",
      "stage": "language"
    },
    {
      "id": "token-concept",
      "type": "language",
      "label": "Token → 词元",
      "stage": "language"
    },
    {
      "id": "token-metering",
      "type": "measurement",
      "label": "Token Metering",
      "stage": "measurement"
    },
    {
      "id": "token-pricing",
      "type": "measurement",
      "label": "Pricing / Settlement",
      "stage": "measurement"
    },
    {
      "id": "ai-standard",
      "type": "standard",
      "label": "AI Standard",
      "stage": "standard"
    },
    {
      "id": "iso-sc42",
      "type": "standard",
      "label": "ISO/IEC JTC 1/SC 42",
      "stage": "standard"
    },
    {
      "id": "ai-governance",
      "type": "governance",
      "label": "AI Governance",
      "stage": "governance"
    },
    {
      "id": "discourse-power",
      "type": "discourse_power",
      "label": "Discourse Power",
      "stage": "discourse_power"
    },
    {
      "id": "china-ai-token-ciyuan-discourse-power",
      "type": "article",
      "label": "Token → 词元",
      "articleUrl": "/articles/china-ai-token-ciyuan-discourse-power",
      "stage": "language"
    },
    {
      "id": "ai-token-economics",
      "type": "article",
      "label": "AI Token Economics",
      "articleUrl": "/articles/ai-token-economics",
      "stage": "measurement"
    },
    {
      "id": "machine-translation",
      "type": "language",
      "label": "AI Translation",
      "stage": "language"
    },
    {
      "id": "local-context",
      "type": "language",
      "label": "Local Context",
      "stage": "language"
    },
    {
      "id": "source-verification",
      "type": "governance",
      "label": "Source Verification",
      "stage": "governance"
    },
    {
      "id": "information-gatekeeper",
      "type": "discourse_power",
      "label": "Information Gatekeeper",
      "stage": "discourse_power"
    },
    {
      "id": "ai-translation-information-gatekeeper",
      "type": "article",
      "label": "AI Translation Gatekeeper",
      "articleUrl": "/articles/ai-translation-information-gatekeeper",
      "stage": "language"
    },
    {
      "id": "deep-inquiry",
      "type": "capability",
      "label": "Deep Inquiry",
      "stage": "discourse_power"
    },
    {
      "id": "ai-era-english-deep-inquiry",
      "type": "article",
      "label": "Translation → Verification → Deep Inquiry",
      "articleUrl": "/articles/ai-era-english-deep-inquiry",
      "stage": "discourse_power"
    }
  ],
  "edges": [
    {
      "from": "language-layer",
      "to": "token-concept",
      "type": "defines"
    },
    {
      "from": "token-concept",
      "to": "token-metering",
      "type": "quantifies"
    },
    {
      "from": "token-metering",
      "to": "token-pricing",
      "type": "enables"
    },
    {
      "from": "token-pricing",
      "to": "ai-standard",
      "type": "standardizes"
    },
    {
      "from": "ai-standard",
      "to": "ai-governance",
      "type": "governs"
    },
    {
      "from": "ai-governance",
      "to": "discourse-power",
      "type": "shapes"
    },
    {
      "from": "ai-standard",
      "to": "iso-sc42",
      "type": "aligns_with"
    },
    {
      "from": "china-ai-token-ciyuan-discourse-power",
      "to": "language-layer",
      "type": "covered_by"
    },
    {
      "from": "china-ai-token-ciyuan-discourse-power",
      "to": "token-concept",
      "type": "covered_by"
    },
    {
      "from": "china-ai-token-ciyuan-discourse-power",
      "to": "discourse-power",
      "type": "covered_by"
    },
    {
      "from": "china-ai-token-ciyuan-discourse-power",
      "to": "ai-standards",
      "type": "belongs_to"
    },
    {
      "from": "china-ai-token-ciyuan-discourse-power",
      "to": "ai-token-economics",
      "type": "next"
    },
    {
      "from": "ai-token-economics",
      "to": "token-metering",
      "type": "covered_by"
    },
    {
      "from": "ai-token-economics",
      "to": "token-pricing",
      "type": "covered_by"
    },
    {
      "from": "ai-token-economics",
      "to": "ai-standard",
      "type": "covered_by"
    },
    {
      "from": "ai-token-economics",
      "to": "ai-standards",
      "type": "belongs_to"
    },
    {
      "from": "ai-token-economics",
      "to": "china-ai-token-ciyuan-discourse-power",
      "type": "previous"
    },
    {
      "from": "ai-token-economics",
      "to": "ai-translation-information-gatekeeper",
      "type": "next"
    },
    {
      "from": "language-layer",
      "to": "machine-translation",
      "type": "enables"
    },
    {
      "from": "machine-translation",
      "to": "local-context",
      "type": "requires"
    },
    {
      "from": "local-context",
      "to": "source-verification",
      "type": "requires"
    },
    {
      "from": "source-verification",
      "to": "information-gatekeeper",
      "type": "informs"
    },
    {
      "from": "information-gatekeeper",
      "to": "discourse-power",
      "type": "shapes"
    },
    {
      "from": "ai-translation-information-gatekeeper",
      "to": "machine-translation",
      "type": "covered_by"
    },
    {
      "from": "ai-translation-information-gatekeeper",
      "to": "local-context",
      "type": "covered_by"
    },
    {
      "from": "ai-translation-information-gatekeeper",
      "to": "information-gatekeeper",
      "type": "covered_by"
    },
    {
      "from": "ai-translation-information-gatekeeper",
      "to": "ai-standards",
      "type": "belongs_to"
    },
    {
      "from": "ai-translation-information-gatekeeper",
      "to": "ai-token-economics",
      "type": "previous"
    },
    {
      "from": "ai-translation-information-gatekeeper",
      "to": "ai-era-english-deep-inquiry",
      "type": "next"
    },
    {
      "from": "source-verification",
      "to": "deep-inquiry",
      "type": "enables"
    },
    {
      "from": "deep-inquiry",
      "to": "discourse-power",
      "type": "informs"
    },
    {
      "from": "ai-era-english-deep-inquiry",
      "to": "machine-translation",
      "type": "covered_by"
    },
    {
      "from": "ai-era-english-deep-inquiry",
      "to": "source-verification",
      "type": "covered_by"
    },
    {
      "from": "ai-era-english-deep-inquiry",
      "to": "deep-inquiry",
      "type": "covered_by"
    },
    {
      "from": "ai-era-english-deep-inquiry",
      "to": "ai-standards",
      "type": "belongs_to"
    },
    {
      "from": "ai-era-english-deep-inquiry",
      "to": "ai-translation-information-gatekeeper",
      "type": "previous"
    }
  ],
  "articles": [
    {
      "id": "china-ai-token-ciyuan-discourse-power",
      "title": "중국은 왜 Token을 ‘词元’이라 부르나｜AI 시대 영어와 담론 권력",
      "url": "/articles/china-ai-token-ciyuan-discourse-power",
      "order": 1,
      "pillar": "ai-standards",
      "topics": [
        "language-layer",
        "token-concept",
        "discourse-power"
      ],
      "stage": "language",
      "previous": null,
      "next": "ai-token-economics",
      "status": "published"
    },
    {
      "id": "ai-token-economics",
      "title": "AI Token은 새로운 경제 단위가 될까｜측정·가격·데이터 가치의 재편",
      "url": "/articles/ai-token-economics",
      "order": 2,
      "pillar": "ai-standards",
      "topics": [
        "token-metering",
        "token-pricing",
        "ai-standard"
      ],
      "stage": "measurement",
      "previous": "china-ai-token-ciyuan-discourse-power",
      "next": "ai-translation-information-gatekeeper",
      "status": "published"
    },
    {
      "id": "ai-translation-information-gatekeeper",
      "title": "AI 번역은 언어 장벽을 없앨까｜AI가 새로운 정보 게이트키퍼가 되는 이유",
      "url": "/articles/ai-translation-information-gatekeeper",
      "order": 3,
      "pillar": "ai-standards",
      "topics": [
        "machine-translation",
        "local-context",
        "information-gatekeeper"
      ],
      "stage": "language",
      "previous": "ai-token-economics",
      "next": "ai-era-english-deep-inquiry",
      "status": "published"
    },
    {
      "id": "ai-era-english-deep-inquiry",
      "title": "AI 시대 영어는 필요 없을까｜Translation → Verification → Deep Inquiry",
      "url": "/articles/ai-era-english-deep-inquiry",
      "order": 4,
      "pillar": "ai-standards",
      "topics": [
        "machine-translation",
        "source-verification",
        "deep-inquiry"
      ],
      "stage": "discourse_power",
      "previous": "ai-translation-information-gatekeeper",
      "next": null,
      "status": "published"
    }
  ]
}
